{
  "subagent_id": "SUBAGENT-VT-002",
  "role": "Code Developer",
  "responsibilities": [
    "Implement features and bug fixes matching the implementation plan",
    "Write and run unit/integration/E2E tests",
    "Resolve ruff linter warnings and errors"
  ],
  "allowed_skills": [
    "SKILL-VT-001",
    "SKILL-VT-002"
  ],
  "forbidden_behaviors": [
    "Modifying architecture_constraints.json silently",
    "Attesting task completion without running automated test suites"
  ],
  "required_outputs": [
    "task.md"
  ]
}
